{
  "schema_version": "RANGEMATCH_ADVISOR_THREE_PAGE@0.1.0",
  "packet_hash": "5269b7dc8e3bd112675d63e1485c3152e8b12260b2a26ccb1bfd2cc07cdeeaba",
  "validation_status": "PASSED",
  "validation_violations": [],
  "page_one_advisor": {
    "how_the_tract_reads": "This tract already has a usable public-data portrait: gentle typical slope, measured rainfall, a recent vegetation snapshot, 9 mapped water identities, 3 of which can be reviewed as map areas, and a road that meets the boundary. The useful question is whether drinking water and a legal entrance can be established, not whether the public maps look complete.",
    "listing_outruns_evidence": [
      "“Excellent year-round water” goes past mapped hydrography. The map is a lead, not a drinker.",
      "“Easy county-road access” goes past physical road contact. Contact is not a recorded entrance.",
      "“Productive pasture ready for cattle” goes past a modeled growth snapshot. That snapshot is not a stocking plan."
    ],
    "do_today": [
      "Ask title or the listing side for the access paper: deed, easement, or recorded entrance.",
      "Ask what “excellent water” refers to — well, tank, pond, or seasonal channel — and for any records they have."
    ],
    "visit_purpose": "VISIT_DEPENDS_ON_DOCUMENT",
    "visit_guidance": "The trip depends on access documentation. If the entrance basis holds, the visit has a defined purpose: inspect mapped water areas and any seller-claimed infrastructure.",
    "what_changes_next": "If the access paper holds, the next spend is the water walk. If the seller cannot show an entrance basis, pause the trip and give title the question. Either way, do not convert the RAP number into a herd size.",
    "what_not_to_recheck": [
      "Do not pay for another annual-precipitation lookup. That number is already measured."
    ]
  },
  "page_two_actions": {
    "messages": [
      {
        "message_id": "MSG_LISTING_WATER",
        "audience": "LISTING_BROKER",
        "bound_action_id": "ACTION_WATER_FIELD_CATEGORY",
        "bound_claim_id": "CLAIM_WATER_001",
        "body": "The listing’s “excellent year-round water” — is that a well, a tank, a pond, or a seasonal channel? Please send the location and any well log, pump record, water-quality, or maintenance material you have."
      },
      {
        "message_id": "MSG_FIELD_WATER",
        "audience": "FIELD_VISITOR",
        "bound_action_id": "ACTION_WATER_FIELD_CATEGORY",
        "bound_claim_id": "CLAIM_WATER_001",
        "body": "Review the mapped water feature areas on the report map — reaches and ponds, not invented pins. Record the date, visible water, livestock access, fence, pipe, tank, or pump signs. This visit cannot confirm year-round flow, water quality, or the legal right to use the water."
      },
      {
        "message_id": "MSG_TITLE_ACCESS",
        "audience": "TITLE_OR_COUNSEL",
        "bound_action_id": "ACTION_ACCESS_DOCUMENTS",
        "bound_claim_id": "CLAIM_ACCESS_001",
        "body": "Please confirm whether the mapped road contact is a recorded legal entrance, and whether title, easements, or exceptions support or limit access at that location."
      },
      {
        "message_id": "MSG_PARTNER",
        "audience": "PARTNER",
        "bound_action_id": "ACTION_ACCESS_DOCUMENTS",
        "bound_claim_id": "CLAIM_ACCESS_001",
        "body": "We are not deciding to abandon this tract. The listing’s access and drinking-water lines still lack supporting materials. We will get the access paper first, then decide whether a site visit is worth the time and airfare."
      }
    ]
  },
  "page_three_kitchen": {
    "parcel_summary": {
      "parcel_id": "ENGINEERING_TEST_GEOMETRY_CPER_001",
      "geometry_hash": "932edc9b3cb36b49b5a8fdd5ffa52cba17874720947865e0916ba069fad5f309",
      "confirmation_status": "CONFIRMED",
      "display_label": "CPER engineering test geometry, Weld County, CO",
      "is_engineering_test_geometry": true
    },
    "map_layers": [
      {
        "layer_id": "USGS_NHDPLUS_HR:NHDWaterbody:120639594",
        "candidate_type": "WATERBODY",
        "display_name": null,
        "kind": "BBOX",
        "bbox": [
          -104.76110501420337,
          40.82291046980667,
          -104.75935221384321,
          40.82497260274206
        ],
        "centroid": null,
        "field_navigation_precision": "AREA_ONLY",
        "review_status": "SAMPLED",
        "evidence_state": "MAPPED_CANDIDATE"
      },
      {
        "layer_id": "USGS_NHDPLUS_HR:NetworkNHDFlowline:120638829",
        "candidate_type": "FLOWLINE",
        "display_name": null,
        "kind": "LINE",
        "bbox": [
          -104.76541568070553,
          40.825831802747125,
          -104.76061101406769,
          40.83281027011377
        ],
        "centroid": null,
        "field_navigation_precision": "AREA_ONLY",
        "review_status": "SAMPLED",
        "evidence_state": "REMOTELY_SUPPORTED"
      },
      {
        "layer_id": "USGS_NHDPLUS_HR:NetworkNHDFlowline:120638830",
        "candidate_type": "FLOWLINE",
        "display_name": "Little Owl Creek",
        "kind": "LINE",
        "bbox": [
          -104.76841921402766,
          40.825831802747125,
          -104.76061101406769,
          40.83201466996486
        ],
        "centroid": null,
        "field_navigation_precision": "AREA_ONLY",
        "review_status": "SAMPLED",
        "evidence_state": "REMOTELY_SUPPORTED"
      }
    ],
    "observations": [
      {
        "observation_id": "OBS_PRECIP",
        "label": "Mean annual precipitation",
        "land_fact_ref": "VAR_F05_MEAN_ANNUAL_PRECIPITATION",
        "value": 345.74,
        "display_value": null,
        "unit": "mm/year",
        "time_period": null,
        "evidence_state": "MEASURED",
        "spatial_meaning": "parcel_aggregate",
        "source_id": "NOAA_NCEI_DIRECT_CLIMATE_NORMALS_NETCDF",
        "source_version": null,
        "geometry_hash": "932edc9b3cb36b49b5a8fdd5ffa52cba17874720947865e0916ba069fad5f309",
        "coverage": {
          "normalized_status": "COMPLETE",
          "source_status": "COMPLETE",
          "details": {
            "detail": "COMPLETE_SINGLE_CELL_COVERS_SMALL_PARCEL",
            "adapter_status": "NOAA_NCEI_DIRECT_CLIMATE_NORMALS_NETCDF"
          }
        },
        "applicability_status": "IN_DOCUMENTED_PRODUCT_SCOPE",
        "confidence_or_quality_status": null,
        "limitations": [
          "Mean annual precipitation is a Land Fact, not a suitability score."
        ],
        "derivation_algorithm_version": "F05_CLIMATE_DROUGHT_DETERMINISTIC_RULES.yaml@0.1.0",
        "allowed_support": [
          "canonical climate lookup is complete"
        ],
        "prohibited_support": [
          "climate adequacy",
          "drought resilience",
          "future performance"
        ]
      },
      {
        "observation_id": "OBS_SLOPE",
        "label": "Median slope",
        "land_fact_ref": "VAR_F01_SLOPE_MEDIAN_DEGREES",
        "value": 2.395727249934432,
        "display_value": null,
        "unit": "degree",
        "time_period": null,
        "evidence_state": "PARCEL_DERIVED",
        "spatial_meaning": "parcel_aggregate",
        "source_id": "USGS_3DEP",
        "source_version": null,
        "geometry_hash": "932edc9b3cb36b49b5a8fdd5ffa52cba17874720947865e0916ba069fad5f309",
        "coverage": {
          "normalized_status": "UNKNOWN",
          "source_status": null,
          "details": {}
        },
        "applicability_status": null,
        "confidence_or_quality_status": null,
        "limitations": [],
        "derivation_algorithm_version": "F01_TOPOGRAPHY_DERIVATION_SPEC.yaml@0.1.0",
        "allowed_support": [
          "gentle typical slope context"
        ],
        "prohibited_support": [
          "suitability",
          "traversability for every animal"
        ]
      },
      {
        "observation_id": "OBS_AREA",
        "label": "Mapped geometric area",
        "land_fact_ref": "VAR_F06_AREA_M2",
        "value": 1404078.7002779155,
        "display_value": null,
        "unit": "m2",
        "time_period": null,
        "evidence_state": "PARCEL_DERIVED",
        "spatial_meaning": "parcel_aggregate",
        "source_id": "CONFIRMED_GEOMETRY",
        "source_version": "F06_PARCEL_CONFIGURATION_DERIVATION@0.1.0",
        "geometry_hash": "932edc9b3cb36b49b5a8fdd5ffa52cba17874720947865e0916ba069fad5f309",
        "coverage": {
          "normalized_status": "UNKNOWN",
          "source_status": null,
          "details": {}
        },
        "applicability_status": null,
        "confidence_or_quality_status": null,
        "limitations": [
          "Parcel area is geometric context, not grazable area or carrying capacity."
        ],
        "derivation_algorithm_version": "F06_PARCEL_CONFIGURATION_DERIVATION@0.1.0",
        "allowed_support": [
          "mapped outline size"
        ],
        "prohibited_support": [
          "grazable acres",
          "fencing cost",
          "survey"
        ]
      },
      {
        "observation_id": "OBS_RAP_PROD",
        "label": "Modeled annual herbaceous production",
        "land_fact_ref": "VAR_F02_ANNUAL_HERB_PRODUCTION",
        "value": 937.6780475452124,
        "display_value": null,
        "unit": "pound_per_acre",
        "time_period": "annual_accumulated_new_growth_2025",
        "evidence_state": "MODELED",
        "spatial_meaning": "parcel_mean",
        "source_id": "RAP_productionV3",
        "source_version": "v3",
        "geometry_hash": "932edc9b3cb36b49b5a8fdd5ffa52cba17874720947865e0916ba069fad5f309",
        "coverage": {
          "normalized_status": "UNQUANTIFIED",
          "source_status": "COVERAGE_UNQUANTIFIED",
          "details": {
            "requested_area_m2": 1406580,
            "eligible_area_m2": null,
            "masked_area_m2": null,
            "no_data_area_m2": null,
            "valid_area_m2": null,